[
  {
    "case_id": "DG-011",
    "dispute_type": "DAMAGED_GOODS",
    "order": {
      "order_id": "ORD-2026-42031",
      "order_value_inr": 1299.0,
      "order_total_cod_inr": null,
      "payment_mode": "PREPAID",
      "product_category": "KITCHENWARE",
      "product_name": "Glass storage jars, set of 3",
      "city": "Bengaluru"
    },
    "customer_evidence": [
      {
        "evidence_id": "CUSTOMER-101",
        "type": "CHAT_MESSAGE",
        "channel": "support_chat",
        "timestamp_ist": "2026-09-02T20:10:00+05:30",
        "text": "Order ORD-2026-42031 arrived today and one of the three glass jars is shattered, the lid is fine but the body is in pieces inside the bubble wrap. Photo attached. Please send a replacement."
      },
      {
        "evidence_id": "CUSTOMER-102",
        "type": "PHOTO",
        "timestamp_ist": "2026-09-02T20:11:00+05:30",
        "photo_description": "Opened shipping box on a kitchen counter; bubble wrap pulled back showing one glass jar broken into several large pieces, two jars intact."
      }
    ],
    "agent_evidence": [
      {
        "evidence_id": "AGENT-101",
        "type": "AGENT_STATEMENT",
        "timestamp_ist": "2026-09-03T10:30:00+05:30",
        "text": "Delivery agent statement recorded by the partner helpdesk: 'Handed the parcel to the customer at the door. Box looked okay to me. Customer did not open it in front of me.'"
      }
    ],
    "delivery_evidence": [
      {
        "evidence_id": "POD-101",
        "type": "POD",
        "timestamp_ist": "2026-09-02T13:40:00+05:30",
        "otp_confirmed": true,
        "gps": "12.9716,77.5946",
        "image_quality": "clear",
        "photo_description": "Brown carton held by the consignee at an apartment door. All visible faces flat and intact, tape unbroken."
      },
      {
        "evidence_id": "DELIVERY-101",
        "type": "DELIVERY_LOG",
        "timestamp_ist": "2026-09-02T13:40:00+05:30",
        "pickup_timestamp_ist": "2026-08-31T18:05:00+05:30",
        "note": "Route BLR-12. Fragile tag applied. Customer account shows 3 prior damaged-goods claims in the last 90 days."
      }
    ],
    "sla_version": "0.1"
  },
  {
    "case_id": "DG-012",
    "dispute_type": "DAMAGED_GOODS",
    "order": {
      "order_id": "ORD-2026-42118",
      "order_value_inr": 8999.0,
      "order_total_cod_inr": null,
      "payment_mode": "PREPAID",
      "product_category": "ELECTRONICS",
      "product_name": "Bluetooth soundbar, 1 unit",
      "city": "Hyderabad"
    },
    "customer_evidence": [
      {
        "evidence_id": "CUSTOMER-103",
        "type": "CHAT_MESSAGE",
        "channel": "email",
        "timestamp_ist": "2026-09-05T11:20:00+05:30",
        "text": "Order ORD-2026-42118 delivered last night. I recorded an unboxing video because it is an expensive item: the soundbar's front grille is dented inward on the right end and the right speaker rattles. The inner foam insert is cracked at the same corner. Video attached."
      },
      {
        "evidence_id": "CUSTOMER-104",
        "type": "PHOTO",
        "timestamp_ist": "2026-09-05T11:21:00+05:30",
        "photo_description": "Still from the customer's unboxing video, recorded 4 Sep at 21:35: soundbar lifted out of its retail box, front metal grille visibly dented at the right end; foam insert cracked at the matching corner."
      }
    ],
    "agent_evidence": [
      {
        "evidence_id": "AGENT-102",
        "type": "AGENT_STATEMENT",
        "timestamp_ist": "2026-09-05T15:00:00+05:30",
        "text": "Delivery agent statement recorded by the partner helpdesk: 'Delivered after OTP. It was dark and raining, I took the photo quickly under the porch light.'"
      }
    ],
    "delivery_evidence": [
      {
        "evidence_id": "POD-102",
        "type": "POD",
        "timestamp_ist": "2026-09-04T21:05:00+05:30",
        "otp_confirmed": true,
        "gps": "17.3850,78.4867",
        "image_quality": "blurry",
        "photo_description": "Dark, motion-blurred image of a large carton at a doorway; package edges and surfaces cannot be made out."
      },
      {
        "evidence_id": "DELIVERY-102",
        "type": "DELIVERY_LOG",
        "timestamp_ist": "2026-09-04T21:05:00+05:30",
        "pickup_timestamp_ist": "2026-09-02T16:40:00+05:30",
        "note": "Route HYD-07. No exception scanned on the route."
      }
    ],
    "sla_version": "0.1"
  },
  {
    "case_id": "DG-013",
    "dispute_type": "DAMAGED_GOODS",
    "order": {
      "order_id": "ORD-2026-42207",
      "order_value_inr": 799.0,
      "order_total_cod_inr": null,
      "payment_mode": "PREPAID",
      "product_category": "HOME_DECOR",
      "product_name": "Printed cotton bedsheet, double",
      "city": "Jaipur"
    },
    "customer_evidence": [
      {
        "evidence_id": "CUSTOMER-105",
        "type": "CHAT_MESSAGE",
        "channel": "support_chat",
        "timestamp_ist": "2026-09-08T09:15:00+05:30",
        "text": "The item in order ORD-2026-42207 is damaged. Not happy. Please refund."
      }
    ],
    "agent_evidence": [
      {
        "evidence_id": "AGENT-103",
        "type": "AGENT_STATEMENT",
        "timestamp_ist": "2026-09-08T12:40:00+05:30",
        "text": "Delivery agent statement recorded by the partner helpdesk: 'Soft polybag parcel, handed over normally. Nothing unusual.'"
      }
    ],
    "delivery_evidence": [
      {
        "evidence_id": "POD-103",
        "type": "POD",
        "timestamp_ist": "2026-09-07T17:25:00+05:30",
        "otp_confirmed": false,
        "gps": "26.9124,75.7873",
        "image_quality": "clear",
        "photo_description": "Sealed grey courier polybag on a doormat. No tears, holes or stains visible."
      },
      {
        "evidence_id": "DELIVERY-103",
        "type": "DELIVERY_LOG",
        "timestamp_ist": "2026-09-07T17:25:00+05:30",
        "pickup_timestamp_ist": "2026-09-05T11:00:00+05:30",
        "note": "Route JAI-02. No exception scanned on the route."
      }
    ],
    "sla_version": "0.1"
  },
  {
    "case_id": "DG-014",
    "dispute_type": "DAMAGED_GOODS",
    "order": {
      "order_id": "ORD-2026-42290",
      "order_value_inr": 2199.0,
      "order_total_cod_inr": null,
      "payment_mode": "PREPAID",
      "product_category": "HOME_DECOR",
      "product_name": "Framed wall mirror, 45 cm",
      "city": "Kochi"
    },
    "customer_evidence": [
      {
        "evidence_id": "CUSTOMER-106",
        "type": "CHAT_MESSAGE",
        "channel": "email",
        "timestamp_ist": "2026-09-15T18:30:00+05:30",
        "text": "Sorry for the late message, I was travelling. My mirror from order ORD-2026-42290 was delivered on the 10th while I was away. When I opened it today the glass is cracked diagonally from the top-left corner and the frame's bottom edge is chipped. Photo attached."
      },
      {
        "evidence_id": "CUSTOMER-107",
        "type": "PHOTO",
        "timestamp_ist": "2026-09-15T18:32:00+05:30",
        "photo_description": "Mirror leaning on a wall: a crack runs diagonally from the top-left corner; a chip is visible on the bottom frame edge. A dented carton is on the floor beside it."
      }
    ],
    "agent_evidence": [
      {
        "evidence_id": "AGENT-104",
        "type": "AGENT_STATEMENT",
        "timestamp_ist": "2026-09-16T10:10:00+05:30",
        "text": "Delivery agent statement recorded by the partner helpdesk: 'Left with the neighbour as instructed. The corner of the box had got pressed in during loading.'"
      }
    ],
    "delivery_evidence": [
      {
        "evidence_id": "POD-104",
        "type": "POD",
        "timestamp_ist": "2026-09-10T12:15:00+05:30",
        "otp_confirmed": false,
        "gps": "9.9312,76.2673",
        "image_quality": "clear",
        "photo_description": "Flat carton handed to a neighbour at a door. The top-left corner of the carton is visibly crushed inward and the outer layer is torn."
      },
      {
        "evidence_id": "DELIVERY-104",
        "type": "DELIVERY_LOG",
        "timestamp_ist": "2026-09-10T12:15:00+05:30",
        "pickup_timestamp_ist": "2026-09-08T14:20:00+05:30",
        "note": "Route COK-05. Delivered to neighbour on customer instruction."
      }
    ],
    "sla_version": "0.1"
  },
  {
    "case_id": "DG-015",
    "dispute_type": "DAMAGED_GOODS",
    "order": {
      "order_id": "ORD-2026-42344",
      "order_value_inr": 5499.0,
      "order_total_cod_inr": null,
      "payment_mode": "PREPAID",
      "product_category": "APPLIANCES",
      "product_name": "Electric kettle, 1.7 L, stainless steel",
      "city": "Lucknow"
    },
    "customer_evidence": [
      {
        "evidence_id": "CUSTOMER-108",
        "type": "CHAT_MESSAGE",
        "channel": "support_chat",
        "timestamp_ist": "2026-09-19T08:50:00+05:30",
        "text": "Kettle from ORD-2026-42344 came yesterday. The base plate is cracked through on one side and the kettle wobbles on it. I took a photo of the base after opening. I didn't make an unboxing video."
      },
      {
        "evidence_id": "CUSTOMER-109",
        "type": "PHOTO",
        "timestamp_ist": "2026-09-19T08:51:00+05:30",
        "photo_description": "Kettle power base on a table with a crack running across one side of the plastic housing."
      }
    ],
    "agent_evidence": [
      {
        "evidence_id": "AGENT-105",
        "type": "AGENT_STATEMENT",
        "timestamp_ist": "2026-09-19T13:00:00+05:30",
        "text": "Delivery agent statement recorded by the partner helpdesk: 'OTP delivery, carton was fine. Customer checked the outside and signed.'"
      }
    ],
    "delivery_evidence": [
      {
        "evidence_id": "POD-105",
        "type": "POD",
        "timestamp_ist": "2026-09-18T16:30:00+05:30",
        "otp_confirmed": true,
        "gps": "26.8467,80.9462",
        "image_quality": "clear",